{
  "schema_version": "3",
  "request_id": "post_lb-20260715T090000Z-allinfo-3nn1nnc",
  "created_at": "2026-07-15T08:50:00Z",
  "stage": "post_lb",
  "policy_version": "campaign:all-info-h100-final-0715",
  "objective": "campaign all-info-h100-final-0715 post_lb: ALL-INFO 3NN(0.7850171837)·1NN+C(0.7318299466) 서버 LB 내부 교차검증 — delta 재계산·묶음(멤버 다변수)·metaN 동률·다양성 레버·시간벽·챔피언 불변·목표차·프레이밍 규율. Codex 미호출.",
  "verify_items": [
    "delta: 3nn vs 챔피언=-0.0016803034; vs metaT(0.6)=-0.0016365060; vs metaN=+0.0000102279; vs cA=+0.0001710325",
    "delta: 1nnc vs metaT_1nn=-0.0017998634; vs 3nn=-0.0531872371",
    "핵심: 3nn≈metaN(+0.0000102279), metaT 미달(-0.00164) → transcript 이득 소실(묶음)",
    "성격: 묶음(pretext+numeric채널+draw 동시변경) — 단독효과·순수 A/B·노이즈 금지",
    "시간벽: 3nn 598s 완주(타임아웃 없음) measured, 1nnc 191s measured",
    "챔피언: metaT_w062 0.7866974871 불변, ALL-INFO 미채택",
    "프레이밍: negative 정직 기록, '125d 원인' 단정 금지 + 명칭정정(ALL-REAL+STABLE-MINT)"
  ],
  "downstream_action": "none",
  "proposed_next_action": "PASS 시 docs-ledger-writer가 실험로그 EOF append + HANDOFF §9/§6 갱신, §1 무변경. 유료 GPU 종료(완료)·다음 발사·제출은 별도 사용자 승인.",
  "lineage_id": "all-info-h100-final-0715-post_lb",
  "direct_control": "submit_metaT(3NN 0.6, 0.7866536897)·metaN(3NN 0.6, 0.7850069558)·metaT_w062(챔피언 0.62, 0.7866974871)·metaT_1nn(0.73362981) — 선행 metant/1nn 감사에서 확립된 프레임",
  "intended_change": "관측 대상: ALL-INFO 3NN·1NN+C 서버 LB(챔피언 프레임 meta멤버를 all-info 묶음으로 교체). 코드/데이터 변경 아님 — LB 해석만.",
  "evidence_paths": [
    "submits/submit_allinfo_3nn.zip",
    "submits/submit_allinfo_1nnc.zip",
    "open/coordination/results/post_lb-20260714T150000Z-metawave1-metant.json",
    "open/coordination/results/post_lb-20260715T030000Z-metawave1-1nn.json"
  ],
  "effective_config_path": "scratchpad/harvest_allinfo/stage_a_effective_config.reconstructed.json",
  "known_caveats": [
    "LB·채점시간은 사용자·서버 보고.",
    "audit_key는 internal_cross_check all-zeros placeholder.",
    "ALL-INFO 멤버 = pretext+numeric채널+draw 다중변경 묶음 — 단독효과 금지.",
    "3nn≈metaN이 '125d 원인' 처럼 보이나 pretext·draw 교란 — 가설까지만.",
    "순수 1nn(BLEND_W1.0) 미제출.",
    "명칭정정: ALL-INFO → ALL-REAL+STABLE-MINT(복원가능 CI/dirty/open 제외).",
    "target_gap 12등 ref는 리더보드 변동값 — 기록 전 라이브 확정."
  ]
}
