{
  "schema_version": "3",
  "request_id": "post_lb-20260715T013000Z-metawave1-blendw",
  "created_at": "2026-07-15T01:15:00Z",
  "stage": "post_lb",
  "policy_version": "campaign:official-meta-wave1",
  "objective": "official-meta-wave1 후속: BLEND_W 0.6→0.62(metaN_w062) LB 실측 기록 게이트 — delta 재계산·matched(단일 스칼라)·챔피언·§5 blend-w frame-specific 재분류·프레이밍 규율 내부 교차검증. Codex 미호출.",
  "verify_items": [
    "delta 재계산: metaN_w062-metaN=+0.0010037485, -cA=+0.0011645531, -metaT=-0.0006429854",
    "matched: metaN_w062 vs metaN은 BLEND_W(0.6→0.62) 단일 스칼라, 동일 멤버·재학습 없음·draw 0",
    "챔피언: metaN_w062 0.7860107043 < metaT 0.7866536897 → META-T 유지",
    "축 재분류: §5 'w=0.6 정점/0.779 포화'는 구프레임 한정 → meta 프레임 살아있는 시간중립 레버(frame-specific 정정, n=1 정점 미확정)",
    "프레이밍: '살아있는 레버(매치드 +0.0010)'까지 허용, '노이즈'·'완전 죽은축' 금지"
  ],
  "downstream_action": "none",
  "proposed_next_action": "PASS 시 docs-ledger-writer가 실험로그 append + HANDOFF §5(blend-w frame-specific)·§6·§9 갱신. metaT_w062/w064 제출·발사는 별도 사용자 승인.",
  "lineage_id": "official-meta-wave1-blendw-post_lb",
  "direct_control": "metaN(BLEND_W 0.6, 0.7850069558) — 동일 META-N 프레임 멤버·transcript, BLEND_W만 0.62로 변경",
  "intended_change": "관측 대상: BLEND_W 0.6→0.62 스칼라 변경의 서버 LB 효과. 코드/데이터/멤버 변경 아님 — LB 해석만.",
  "evidence_paths": [
    "open/docs/실험로그.md",
    "open/coordination/results/post_lb-20260714T150000Z-metawave1-metant.json",
    "submits/submit_metaN_w062.zip",
    "submits/submit_metaT_w062.zip",
    "submits/submit_metaT_w064.zip"
  ],
  "effective_config_path": null,
  "known_caveats": [
    "LB·채점시간은 사용자·서버 보고.",
    "audit_key는 internal_cross_check all-zeros placeholder.",
    "w062 zip은 build-sanity만·스테이징 정리 → 독립 byte-diff 미수행(문서·런타임 근접으로 matched 뒷받침).",
    "metaT 프레임 전이·정점은 미확정(별도 실측)."
  ]
}
