{
 "schema_version": "3",
 "request_id": "pre_launch-20260714T073000Z-mint2v2-deploy",
 "created_at": "2026-07-14T07:20:00Z",
 "stage": "pre_launch",
 "policy_version": "campaign:mint2v2-dualseed-0714",
 "objective": "campaign mint2v2-dualseed-0714 DEPLOY_REFIT 발사 직전 pre_launch: 배포 config(양 dep dir)가 gate 레시피와 매치드(정의된 배포 변형 딱 2개: ①StageA EXTRA_DATA gate→full v2 ②StageB HOLDOUT→REFIT_ONLY)이고 제출 멤버(submit_base2.zip)를 올바르게 생성하는지 내부 교차검증. read-only 실측. ★Codex 미호출(campaign 금지).",
 "verify_items": [
  "A: 양 dep dir(run_mint2v2dep_s79, run_mint2v2dep_s81) colab sha256 = ec60a75381b4d6f9 승인본 + feat 91c419d6, 체크포인트 미재사용(dep dir=colab+feat+data뿐)",
  "B: Deploy Stage A = gate Stage A와 EXTRA_DATA만 상이(gate→full v2 17d75352). EPOCHS=3·PRETEXT_META=omit·TB_V2=1·TARGET_BALANCE=1·PRETEXT=1·COMMON byte-동일. dose6(6ep/keep/v1) 아님",
  "C: Deploy Stage B = REFIT_ONLY=1(HOLDOUT_IDX/HOLDOUT_ONLY 없음), 상호배타 assert(HOLDOUT_ONLY∧REFIT_ONLY / SKIP_REFIT∧REFIT_ONLY) 무위반, REFIT_ONLY 경로가 submit_base2.zip 생성",
  "D: full v2 data SHA=17d753527a40 + labels aea580d3(EXTRA_DATA.replace label pairing). 배포는 정의된 변형(gate→full) confound 아님",
  "E: GPU0/1 idle·분리, dep dir 별도, colab proc 0"
 ],
 "downstream_action": "launch",
 "proposed_next_action": "PASS 시 지휘자가 campaign 승인하에 s79 GPU0(run_mint2v2dep_chain.sh 79 0) / s81 GPU1(... 81 1) 배포 체인 발사. PASS는 진행 자격일 뿐 발사 트리거는 지휘자 절차.",
 "lineage_id": "mint2v2-dualseed-0714-deploy",
 "direct_control": "gate 체인 run_mint2v2_chain.sh(밴드 통과 멤버 생성 레시피) + card1 배포 전례 run_mint2bdep_dose6_chain.sh(StageA full + StageB REFIT_ONLY 구조) — deploy가 gate와 EXTRA_DATA만, card1 전례와 구조 일치(단 v2 레시피 omit·TB_V2·3ep)인지",
 "intended_change": "정의된 배포 변형 2개(단일변수 아님·묶음 아님, gate→deploy 표준 전이): ①StageA EXTRA_DATA gate(05fad50e,5454)→full v2(17d75352,6829) ②StageB HOLDOUT_IDX/HOLDOUT_ONLY→REFIT_ONLY=1(70k 전체재학습, 홀드아웃 없음). StageA 하이퍼파라미터·PRETEXT_META·TB_V2·COMMON·StageB EPOCHS/INIT_BACKBONE 불변.",
 "code_sha256": {
  "open/scripts/colab_train_base2.py": "ec60a75381b4d6f97fde5bd34e35e3ba572803649d0849b73940bef2748e0abd",
  "open/scripts/feat.py": "91c419d634a85ad912d3dc43b9c802ddf0f1a31b0a203345cb38779b30b05ca8"
 },
 "data_sha256": {},
 "sha_notes": {
  "remote:~/dacon/run_mint2v2dep_s79/colab_train_base2.py": "sha256sum on 치타 = ec60a75381b4d6f9... (=승인본)",
  "remote:~/dacon/run_mint2v2dep_s81/colab_train_base2.py": "sha256sum on 치타 = ec60a75381b4d6f9... (=승인본)",
  "remote:~/dacon/run_mint2v2dep_chain.sh": "sha256sum on 치타 = 6a0ccaad31230537...",
  "remote:~/dacon/data/train_mint2_balanced_v2.jsonl": "sha256sum = 17d753527a40... (6829행); labels = aea580d3...",
  "remote:~/dacon/data/train_mint2_balanced_v2_gate.jsonl": "sha256sum = 05fad50e... (5454행, gate 대조)"
 },
 "effective_config_path": null,
 "known_caveats": [
  "원격 파일 SHA/체인/GPU 상태는 read-only SSH(sha256sum·diff·grep·ls·nvidia-smi)로만 실측 — 파일 수정·발사 없음.",
  "effective_config_A/B.json(EPOCHS/EXTRA_DATA/REFIT_ONLY 반영)·refit F1·submit_base2.zip은 발사 후 산출물 — 이 감사는 배선/레시피 매치까지만.",
  "full v2 jsonl 행수 구성(70k+3180 direct-mint 계보)·홀드세션 누수(체크리스트 #7~#9)는 data-lineage-auditor 소관 — 이 감사는 SHA가 승인 아티팩트(17d75352/aea580d3)임만 확인."
 ]
}